### ISSUE TITLE
[BUG] 在 cloud 节点的 host network 中无法通过 Cluster IP 访问边缘节点上的服务，但其 Pod IP 却可以

### ISSUE THREAD

**Issue by crazytaxii** [openyurtio/openyurt#1892]
**What happened**:

环境：

```bash
$ kubectl get nodes
NAME          STATUS   ROLES                         AGE   VERSION
edge-node-1   Ready    <none>                        27d   v1.22.3
edge-node-2   Ready    <none>                        21d   v1.22.3
yurt-cloud    Ready    control-plane,master,worker   28d   v1.22.3

$ kubectl get po -o wide | grep nginx
nginx-deployment-69ff754794-46fth                    1/1     Running   0               5h55m   10.233.68.67   edge-node-1   <none>           <none>

$ kubectl get svc | grep nginx
nginx-service         ClusterIP   10.255.31.243   <none>        80/TCP         5h53m
```

> yurt-cloud 为 cloud 节点；edge-node-1 和 edge-node-2  均为边缘节点。

直接在 yurt-cloud 节点上的  host network 中（不是容器中）能够通过 Pod IP 跨访问边缘节点上的服务，但无法通过其 Service 的 Cluster IP 访问：**在 yurt-cloud 节点上**使用 telnet 通过 Cluster IP 10.255.31.243 无法建立 TCP 连接；但 Pod IP 10.233.68.67 却可以。

**What you expected to happen**:

不论 Pod IP 还是 Cluster IP 均可以正常访问服务（**上述环境落在 yurt-cloud 节点上的  Pod 中两者均可以成功建立连接**）

**How to reproduce it (as minimally and precisely as possible)**:

通过 Raven 跨物理区域组网的环境可能均有该问题。

**Anything else we need to know?**:

`telnet 10.255.31.243 80` 的**同时**在 your-cloud 节点上和 nginx Pod 网络命名空间内同时抓包得知：

- TCP *SYN* 数据包通过隧道顺利到达 edge-node-1 节点并出现在 redis Pod eth0 网卡（veth）上
- nginx 服务收到 *SYN* 后应答 *SYN ACK* TCP 包
- *SYN ACK* TCP 包通过 IPSec 隧道顺利回到 yurt-cloud 节点并出现在 eth0 网卡上（已解封）
- **但 telnet 并未进入成功建立连接状态**

该 Kubernetes 环境中 kube-proxy 使用 IPVS 来将 Cluster IP DNAT 成 Pod IP：

```bash
$ ipvsadm -L -n -t 10.255.31.243:80
Prot LocalAddress:Port Scheduler Flags
  -> RemoteAddress:Port           Forward Weight ActiveConn InActConn
TCP  10.255.31.243:80 rr
  -> 10.233.68.67:80              Masq    1      0          0
```

telnet 的**同时**观察 conntrack 状态与 telnet 本身连接状态：

```bash
$ conntrack -E -o ktimestamp | grep 10.255.31.243
    [NEW] tcp      6 120 SYN_SENT src=10.255.31.243 dst=10.255.31.243 sport=57232 dport=80 [UNREPLIED] src=10.233.68.67 dst=10.233.64.0 sport=80 dport=16167
 [UPDATE] tcp      6 60 SYN_RECV src=10.255.31.243 dst=10.255.31.243 sport=57232 dport=80 src=10.233.68.67 dst=10.233.64.0 sport=80 dport=16167
 [UPDATE] tcp      6 60 SYN_RECV src=10.255.31.243 dst=10.255.31.243 sport=57232 dport=80 src=10.233.68.67 dst=10.233.64.0 sport=80 dport=16167
 [UPDATE] tcp      6 60 SYN_RECV src=10.255.31.243 dst=10.255.31.243 sport=57232 dport=80 src=10.233.68.67 dst=10.233.64.0 sport=80 dport=16167
 [UPDATE] tcp      6 60 SYN_RECV src=10.255.31.243 dst=10.255.31.243 sport=57232 dport=80 src=10.233.68.67 dst=10.233.64.0 sport=80 dport=16167
 [UPDATE] tcp      6 60 SYN_RECV src=10.255.31.243 dst=10.255.31.243 sport=57232 dport=80 src=10.233.68.67 dst=10.233.64.0 sport=80 dport=16167

$ netstat -ant | grep 10.255.31.243
tcp        0      1 10.255.31.243:57232     10.255.31.243:80        SYN_SENT
```

- **NAT 时源端口改变（57232 -> 16167），在 nginx Pod 网络命名空间内同时抓包也能看到**
- conntrack 由 *SYN_SENT* 更新至 *SYN_RECV* 状态
- telnet 的 TCP 连接仍处于 *SYN_SENT* 状态

由上述信息推断，**nginx 应答的 *SYN ACK* 包成功到达 yurt-cloud 节点的 conntrack，但并未到达 telnet**。

因为 OpenYurt 中跨物理区域节点使用的是 IPSec 隧道，在 Linux 内核中基于 XFRM 框架实现，我们同时观察到 /proc/net/xfrm_stat 中的 *XfrmInNoPols* 计数随着 telnet 尝试次数增加：

```bash
$ watch 'awk "NR=12" /proc/net/xfrm_stat'
Every 2.0s: awk "NR=12" /proc/net/xfrm_stat                                                                                                   yurt-cloud: Mon Oct 16 16:43:27 2023

XfrmInError                     0
XfrmInBufferError               0
XfrmInHdrError                  0
XfrmInNoStates                  0
XfrmInStateProtoError           0
XfrmInStateModeError            0
XfrmInStateSeqError             0
XfrmInStateExpired              0
XfrmInStateMismatch             0
XfrmInStateInvalid              0
XfrmInTmplMismatch              0
XfrmInNoPols                    171
XfrmInPolBlock                  0
XfrmInPolError                  0
XfrmOutError                    0
XfrmOutBundleGenError           0
XfrmOutBundleCheckError         0
XfrmOutNoStates                 0
XfrmOutStateProtoError          0
XfrmOutStateModeError           0
XfrmOutStateSeqError            0
```

尝试找出丢包点，编写脚本**并发 telnet**，并利用 dropwatch 观察：

```bash
$ dropwatch -l kas
Initalizing kallsyms db
dropwatch> start
Enabling monitoring...
Kernel monitoring activated.
Issue Ctrl-C to stop monitoring
16 drops at ip_rcv+11b (0xffffffffb04cb47b)
5 drops at __init_scratch_end+d4f6a99 (0xffffffffc0af6a99)
11 drops at skb_queue_purge+18 (0xffffffffb0412258)
2 drops at tcp_validate_incoming+fc (0xffffffffb04e77fc)
2 drops at ip_rcv_finish+212 (0xffffffffb04cad02)
34 drops at ip_rcv+11b (0xffffffffb04cb47b)
1 drops at __init_scratch_end+d4f6a99 (0xffffffffc0af6a99)
2 drops at skb_queue_purge+18 (0xffffffffb0412258)
2 drops at ip_rcv_finish+212 (0xffffffffb04cad02)
1 drops at sk_stream_kill_queues+50 (0xffffffffb041a500)
1 drops at sk_stream_kill_queues+50 (0xffffffffb041a500)
2 drops at ip_rcv_finish+212 (0xffffffffb04cad02)
1 drops at __init_scratch_end+d4f6a99 (0xffffffffc0af6a99)
2 drops at skb_queue_purge+18 (0xffffffffb0412258)
2 drops at ip_rcv+11b (0xffffffffb04cb47b)
2 drops at unix_stream_connect+2f0 (0xffffffffb0557ca0)
4 drops at __init_scratch_end+d4f6a99 (0xffffffffc0af6a99)
7 drops at skb_queue_purge+18 (0xffffffffb0412258)
1 drops at tcp_v4_do_rcv+70 (0xffffffffb04f6510)
3 drops at tcp_validate_incoming+fc (0xffffffffb04e77fc)
1 drops at sk_stream_kill_queues+50 (0xffffffffb041a500)
3 drops at __init_scratch_end+d4f6a99 (0xffffffffc0af6a99)
7 drops at skb_queue_purge+18 (0xffffffffb0412258)
2 drops at tcp_validate_incoming+fc (0xffffffffb04e77fc)
13 drops at ip_rcv+11b (0xffffffffb04cb47b)
1 drops at tcp_validate_incoming+fc (0xffffffffb04e77fc)
3 drops at tcp_validate_incoming+fc (0xffffffffb04e77fc)
1 drops at ip6_mc_input+1e6 (0xffffffffb05608f6)
1 drops at sk_stream_kill_queues+50 (0xffffffffb041a500)
1 drops at ip_rcv_finish+212 (0xffffffffb04cad02)
3 drops at tcp_v4_rcv+81 (0xffffffffb04f7f41)
1 drops at tcp_v4_do_rcv+70 (0xffffffffb04f6510)
1 drops at ip_rcv_finish+212 (0xffffffffb04cad02)
182 drops at tcp_v4_rcv+81 (0xffffffffb04f7f41)
1 drops at sk_stream_kill_queues+50 (0xffffffffb041a500)
1 drops at tcp_v4_rcv+81 (0xffffffffb04f7f41)
2 drops at ip_rcv+11b (0xffffffffb04cb47b)
1 drops at tcp_v4_do_rcv+70 (0xffffffffb04f6510)
2 drops at ip_rcv+11b (0xffffffffb04cb47b)
1 drops at ip_rcv_finish+212 (0xffffffffb04cad02)
14 drops at tcp_v4_rcv+81 (0xffffffffb04f7f41)
2 drops at ip_rcv+11b (0xffffffffb04cb47b)
13 drops at ip_rcv+11b (0xffffffffb04cb47b)
1 drops at sk_stream_kill_queues+50 (0xffffffffb041a500)
1 drops at tcp_validate_incoming+fc (0xffffffffb04e77fc)
5 drops at __init_scratch_end+d4f6a99 (0xffffffffc0af6a99)
5 drops at skb_queue_purge+18 (0xffffffffb0412258)
1 drops at sk_stream_kill_queues+50 (0xffffffffb041a500)
1 drops at __init_scratch_end+d4f6a99 (0xffffffffc0af6a99)
1 drops at skb_queue_purge+18 (0xffffffffb0412258)
19 drops at ip_rcv+11b (0xffffffffb04cb47b)
1 drops at ip_rcv_finish+212 (0xffffffffb04cad02)
1 drops at sk_stream_kill_queues+50 (0xffffffffb041a500)
1 drops at ip_rcv_finish+212 (0xffffffffb04cad02)
93 drops at tcp_v4_rcv+81 (0xffffffffb04f7f41)
5 drops at ip_rcv+11b (0xffffffffb04cb47b)
1 drops at tcp_v4_do_rcv+70 (0xffffffffb04f6510)
2 drops at ip_rcv_finish+212 (0xffffffffb04cad02)
1 drops at tcp_v4_rcv+81 (0xffffffffb04f7f41)
7 drops at ip_rcv+11b (0xffffffffb04cb47b)
1 drops at sk_stream_kill_queues+50 (0xffffffffb041a500)
5 drops at ip_rcv+11b (0xffffffffb04cb47b)
21 drops at ip_rcv+11b (0xffffffffb04cb47b)
209 drops at tcp_v4_rcv+81 (0xffffffffb04f7f41)
5 drops at ip_rcv+11b (0xffffffffb04cb47b)
2 drops at tcp_validate_incoming+fc (0xffffffffb04e77fc)
1 drops at sk_stream_kill_queues+50 (0xffffffffb041a500)
1 drops at tcp_validate_incoming+fc (0xffffffffb04e77fc)
1 drops at ip_rcv_finish+212 (0xffffffffb04cad02)
1 drops at tcp_v4_do_rcv+70 (0xffffffffb04f6510)
2 drops at ip_rcv_finish+212 (0xffffffffb04cad02)
1 drops at ip_rcv+11b (0xffffffffb04cb47b)
53 drops at tcp_v4_rcv+81 (0xffffffffb04f7f41)
1 drops at tcp_validate_incoming+fc (0xffffffffb04e77fc)
2 drops at tcp_validate_incoming+fc (0xffffffffb04e77fc)
1 drops at ip_rcv_finish+212 (0xffffffffb04cad02)
15 drops at ip_rcv+11b (0xffffffffb04cb47b)
3 drops at sk_stream_kill_queues+50 (0xffffffffb041a500)
33 drops at tcp_v4_rcv+81 (0xffffffffb04f7f41)
1 drops at tcp_v4_do_rcv+70 (0xffffffffb04f6510)
203 drops at tcp_v4_rcv+81 (0xffffffffb04f7f41)
1 drops at tcp_validate_incoming+fc (0xffffffffb04e77fc)
1 drops at __init_scratch_end+d4f6a99 (0xffffffffc0af6a99)
2 drops at skb_queue_purge+18 (0xffffffffb0412258)
2 drops at ip_rcv_finish+212 (0xffffffffb04cad02)
1 drops at sk_stream_kill_queues+50 (0xffffffffb041a500)
1 drops at tcp_v4_do_rcv+70 (0xffffffffb04f6510)
1 drops at __init_scratch_end+d4f6a99 (0xffffffffc0af6a99)
2 drops at skb_queue_purge+18 (0xffffffffb0412258)
104 drops at tcp_v4_rcv+81 (0xffffffffb04f7f41)
3 drops at __init_scratch_end+d4f6a99 (0xffffffffc0af6a99)
6 drops at skb_queue_purge+18 (0xffffffffb0412258)
1 drops at tcp_validate_incoming+fc (0xffffffffb04e77fc)
1 drops at ip_rcv_finish+212 (0xffffffffb04cad02)
1 drops at sk_stream_kill_queues+50 (0xffffffffb041a500)
13 drops at ip_rcv+11b (0xffffffffb04cb47b)
1 drops at tcp_validate_incoming+fc (0xffffffffb04e77fc)
4 drops at __init_scratch_end+d4f6a99 (0xffffffffc0af6a99)
3 drops at skb_queue_purge+18 (0xffffffffb0412258)
1 drops at ip6_mc_input+1e6 (0xffffffffb05608f6)
1 drops at sk_stream_kill_queues+50 (0xffffffffb041a500)
1 drops at ip_rcv_finish+212 (0xffffffffb04cad02)
5 drops at ip_rcv+11b (0xffffffffb04cb47b)
7 drops at __init_scratch_end+d4f6a99 (0xffffffffc0af6a99)
16 drops at skb_queue_purge+18 (0xffffffffb0412258)
8 drops at ip_rcv+11b (0xffffffffb04cb47b)
1 drops at tcp_validate_incoming+fc (0xffffffffb04e77fc)
1 drops at ip_rcv_finish+212 (0xffffffffb04cad02)
1 drops at tcp_validate_incoming+fc (0xffffffffb04e77fc)
1 drops at tcp_v4_do_rcv+70 (0xffffffffb04f6510)
1 drops at ip6_mc_input+1e6 (0xffffffffb05608f6)
2 drops at ip_rcv+11b (0xffffffffb04cb47b)
1 drops at tcp_validate_incoming+fc (0xffffffffb04e77fc)
1 drops at ip_rcv_finish+212 (0xffffffffb04cad02)
1 drops at sk_stream_kill_queues+50 (0xffffffffb041a500)
1 drops at tcp_validate_incoming+fc (0xffffffffb04e77fc)
11 drops at ip_rcv+11b (0xffffffffb04cb47b)
1 drops at sk_stream_kill_queues+50 (0xffffffffb041a500)
2 drops at ip_rcv_finish+212 (0xffffffffb04cad02)
1 drops at tcp_v4_do_rcv+70 (0xffffffffb04f6510)
60 drops at tcp_v4_rcv+81 (0xffffffffb04f7f41)
2 drops at __init_scratch_end+d4f6a99 (0xffffffffc0af6a99)
2 drops at skb_queue_purge+18 (0xffffffffb0412258)
```

找到大量丢包的点为 *tcp_v4_rcv* 函数，**iptables 即 netfilter 中并未发生丢包**。

> 操作系统为 Rocky Linux 8.9，内核版本 4.18.0-477.27.1.el8_8.x86_64

<https://github.com/torvalds/linux/blob/21684dc46c598e477707487c009f9773f7c0382d/net/ipv4/tcp_ipv4.c#L1689-L1902>

```c
int tcp_v4_rcv(struct sk_buff *skb)
{
// a lot of code here
lookup:
    sk = __inet_lookup_skb(&tcp_hashinfo, skb, __tcp_hdrlen(th), th->source,
                   th->dest, sdif, &refcounted);
    if (!sk)
        goto no_tcp_socket;
// a lot of code here
no_tcp_socket:
    if (!xfrm4_policy_check(NULL, XFRM_POLICY_IN, skb))
        goto discard_it;
// a lot of code here
discard_it:
    /* Discard frame. */
    kfree_skb(skb);
    return 0;
}
```

- 因为根据 IP + **错误的**端口无法找到 TCP 套接字，进入 `no_tcp_socket`
- `xfrm4_policy_check` 检查 xfrm policy，并更新 /proc/net/xfrm_stat 文件，因此我们观察到 XfrmInNoPols 计数不断增长
- 进入 `discard_it`，丢包

关键信息：**IPVS DNAT 时为什么源端口（sport）会被更改或没被改回来，很可能跟 XFRM 有关**

**Environment**:
- OpenYurt version: v1.4
- Kubernetes version (use `kubectl version`):  v1.22.3
- OS (e.g: `cat /etc/os-release`): Rocky Linux 8.9
- Kernel (e.g. `uname -a`): 4.18.0-477.27.1.el8_8.x86_64

/kind bug

**Comment by hackerain** [comment]
做了几个测试：

1. 在正常的k8s环境中，可以看到端口也是发生变化的（56386 -> 58123），但是能够正常建立连接：

```
[root@master-1 ~]# conntrack -E | grep 10.6.
    [NEW] tcp      6 120 SYN_SENT src=10.6.242.58 dst=10.6.242.58 sport=56386 dport=8080 [UNREPLIED] src=10.5.1.9 dst=10.5.0.0 sport=80 dport=58123
 [UPDATE] tcp      6 60 SYN_RECV src=10.6.242.58 dst=10.6.242.58 sport=56386 dport=8080 src=10.5.1.9 dst=10.5.0.0 sport=80 dport=58123
 [UPDATE] tcp      6 432000 ESTABLISHED src=10.6.242.58 dst=10.6.242.58 sport=56386 dport=8080 src=10.5.1.9 dst=10.5.0.0 sport=80 dport=58123 [ASSURED]
```
* cluter ip network: 10.6.0.0/16
* pod network: 10.5.0.0/16

2. 在纯手工配置的lvs+ipsec的环境中，也能复现该问题：

```
[root@vm1 ~]# ipvsadm -ln
IP Virtual Server version 1.2.1 (size=4096)
Prot LocalAddress:Port Scheduler Flags
  -> RemoteAddress:Port           Forward Weight ActiveConn InActConn
TCP  10.10.0.1:8080 rr
  -> 192.168.0.178:80             Masq    1      0          0
```

```
    [NEW] tcp      6 120 SYN_SENT src=10.10.0.1 dst=10.10.0.1 sport=47162 dport=8080 [UNREPLIED] src=192.168.0.178 dst=172.16.0.124 sport=80 dport=47162
 [UPDATE] tcp      6 60 SYN_RECV src=10.10.0.1 dst=10.10.0.1 sport=47162 dport=8080 src=192.168.0.178 dst=172.16.0.124 sport=80 dport=47162
 [UPDATE] tcp      6 60 SYN_RECV src=10.10.0.1 dst=10.10.0.1 sport=47162 dport=8080 src=192.168.0.178 dst=172.16.0.124 sport=80 dport=47162
 [UPDATE] tcp      6 60 SYN_RECV src=10.10.0.1 dst=10.10.0.1 sport=47162 dport=8080 src=192.168.0.178 dst=172.16.0.124 sport=80 dport=47162
```
* 10.10.0.1 为 direct server vip
* 192.168.0.0/24为direct server所在网络，172.16.0.0/24为real server所在网络，这两个网络通过ipsec 打通vpn
* 可以看到该环境端口没有发生变化，但是依然无法建立连接。

kube-proxy的ipvs模式使用的是ipvs的nat模式，大致的发包流程为：当通过ds去访问rs时，会先由lvs做dnat，然后再由kube-proxy下发的iptables规则做snat，然后再通过ipsec的加密通道发给rs，rs回包时，会根据源地址，发回给ds，ipsec解密该包，然后再由lvs做snat，将源ip变成vip，发回给客户端。

因为直接通过ds的本机IP访问rs是可以连通的，它的tcp建立连接的抓包如下：

```
10:54:40.642495 fa:16:3e:79:75:10 > fa:16:3e:57:e6:3f, ethertype IPv4 (0x0800), length 138: 192.168.0.79.4500 > 10.0.219.241.51692: UDP-encap: ESP(spi=0xec1c47b0,seq=0x14), length 96
10:54:40.643321 fa:16:3e:57:e6:3f > fa:16:3e:79:75:10, ethertype IPv4 (0x0800), length 138: 10.0.219.241.51692 > 192.168.0.79.4500: UDP-encap: ESP(spi=0x05b42d72,seq=0x21), length 96
10:54:40.643375 fa:16:3e:57:e6:3f > fa:16:3e:79:75:10, ethertype IPv4 (0x0800), length 74: 10.5.2.12.80 > 10.5.0.0.38612: Flags [S.], seq 3519972049, ack 3268900503, win 27960, options [mss 1410,sackOK,TS val 264066508 ecr 752034409,nop,wscale 7], length 0
10:54:40.643429 fa:16:3e:79:75:10 > fa:16:3e:57:e6:3f, ethertype IPv4 (0x0800), length 130: 192.168.0.79.4500 > 10.0.219.241.51692: UDP-encap: ESP(spi=0xec1c47b0,seq=0x15), length 88
```
可以看到正常情况下，通过ipsec建立tcp连接，是有三个加密的UDP包的，分别对应syn, syn+ack, ack，第三个可以看到一个解密之后的syn+ack包。

再来看下通过vip去访问rs时，它的tcp连接的抓包：

```
[root@master-1 ~]# tcpdump -enni eth0 not port 22 and not port 123  and not port 6443
dropped privs to tcpdump
tcpdump: verbose output suppressed, use -v or -vv for full protocol decode
listening on eth0, link-type EN10MB (Ethernet), capture size 262144 bytes
11:02:25.487006 fa:16:3e:79:75:10 > fa:16:3e:57:e6:3f, ethertype IPv4 (0x0800), length 138: 192.168.0.79.4500 > 10.0.219.241.51692: UDP-encap: ESP(spi=0xec1c47b0,seq=0x17), length 96
11:02:25.489072 fa:16:3e:57:e6:3f > fa:16:3e:79:75:10, ethertype IPv4 (0x0800), length 138: 10.0.219.241.51692 > 192.168.0.79.4500: UDP-encap: ESP(spi=0x05b42d72,seq=0x24), length 96
11:02:25.489190 fa:16:3e:57:e6:3f > fa:16:3e:79:75:10, ethertype IPv4 (0x0800), length 74: 10.5.2.12.80 > 10.5.0.0.3258: Flags [S.], seq 1668463011, ack 1819170664, win 27960, options [mss 1410,sackOK,TS val 264531344 ecr 60069122,nop,wscale 7], length 0
11:02:26.502801 fa:16:3e:57:e6:3f > fa:16:3e:79:75:10, ethertype IPv4 (0x0800), length 138: 10.0.219.241.51692 > 192.168.0.79.4500: UDP-encap: ESP(spi=0x05b42d72,seq=0x25), length 96
11:02:26.502897 fa:16:3e:57:e6:3f > fa:16:3e:79:75:10, ethertype IPv4 (0x0800), length 74: 10.5.2.12.80 > 10.5.0.0.3258: Flags [S.], seq 1668463011, ack 1819170664, win 27960, options [mss 1410,sackOK,TS val 264532358 ecr 60069122,nop,wscale 7], length 0
11:02:26.532879 fa:16:3e:79:75:10 > fa:16:3e:57:e6:3f, ethertype IPv4 (0x0800), length 138: 192.168.0.79.4500 > 10.0.219.241.51692: UDP-encap: ESP(spi=0xec1c47b0,seq=0x18), length 96
11:02:26.533584 fa:16:3e:57:e6:3f > fa:16:3e:79:75:10, ethertype IPv4 (0x0800), length 138: 10.0.219.241.51692 > 192.168.0.79.4500: UDP-encap: ESP(spi=0x05b42d72,seq=0x26), length 96
11:02:26.533626 fa:16:3e:57:e6:3f > fa:16:3e:79:75:10, ethertype IPv4 (0x0800), length 74: 10.5.2.12.80 > 10.5.0.0.3258: Flags [S.], seq 1668463011, ack 1819170664, win 27960, options [mss 1410,sackOK,TS val 264532389 ecr 60069122,nop,wscale 7], length 0
```
可以看到只有2个UDP加密包和一个解密之后的syn+ack包，没有length=88的ack包，说明ds收到了rs发送的syn+ack包，但是因为什么原因这个包被丢弃了，所以ds没有发出来ack包，因为rs没有收到ack包，就一直在发起syn重传。

所以问题就在于为什么这个syn+ack包被丢弃了，结合上面楼主提到的XfrmInNoPols不断增长，发现正是由于xfrm policy导致的，ipsec依赖内核xfrm模块实现的esp协议做加密通信，xfrm policy的作用是要给哪些数据做加解密，在收到一个加密包，解密完成之后，还要再检查下policy，如果根据源和目的地址，找不到这个policy，或者是找到对应policy，但是不匹配里面定义的规则，则会丢弃该包，而XfrmInNoPols的意思，就是表示找不到对应的xfrm policy，所以把包给丢了，对应的内核代码在：

* https://github.com/torvalds/linux/blob/21684dc46c598e477707487c009f9773f7c0382d/net/ipv4/tcp_ipv4.c#L1796
* https://github.com/torvalds/linux/blob/21684dc46c598e477707487c009f9773f7c0382d/net/xfrm/xfrm_policy.c#L2443

上面k8s环境，对应的容器网络10.5.0.0/16的隧道的xfrm policy如下：

```
[root@master-1 ~] ip xfrm policy
......
src 10.5.2.0/23 dst 10.5.0.0/23
        dir in priority 1757906 ptype main
        tmpl src 10.0.219.241 dst 192.168.0.79
                proto esp reqid 16641 mode tunnel
......
```

再结合上面的抓包来看，syn+ack中的源和目的地址，其实是能匹配上这个policy的，那为什么还会报找不到这个policy呢？结合上面lvs的nat原理，有理由怀疑，这里收到的syn+ack包的源地址，在进行xfrm_policy_check()之前，已经是被lvs做过snat之后的地址了，即这里的src被改成ds的vip地址，准备要发回给客户端的，所以会报找不到policy，通过手动添加如下的xfrm policy，可以验证这个想法：

```
[root@master-1 ~]# ip xfrm policy add src 10.6.0.0/16 dst 10.5.0.0/23 dir in ptype main action allow priority 1757906 tmpl src 10.0.219.241 dst 192.168.0.79 proto esp mode  tunnel reqid 16641
```

```
src 10.6.0.0/16 dst 10.5.0.0/23
        dir in priority 1757906 ptype main
        tmpl src 10.0.219.241 dst 192.168.0.79
                proto esp reqid 16641 mode tunnel
```

有了上面的policy之后，确实在本机通过cluster ip，即lvs的vip，就可以连通边缘节点的pod地址了。

不太了解lvs的代码，但是从上面的现象来看，lvs+ipsec，这种组合，在某种情况下会产生冲突，像这种直接在ds本机通过vip连接rs时，就会遇到这种情况，但是如果客户端是别的节点（比如在pod里），或者是直接通过ds本机ip连接rs，都不会有问题。

**Comment by BSWANG** [comment]
@hackerain @crazytaxii 

Kube-proxy的 iptables 模式是可以访问通的
两个对比下来发现的区别是在：
__xfrm_policy_check -> nf_nat_decode_session 取到的flow 信息的差异
* iptables中能取到原始的 flow的 src ip和 dst ip，然后在xfrm_policy_lookup 就能找到 raven 设置的规则
* ipvs 中取到的flow 信息只有 dst ip 是对的，src ip 不对，然后在后续的xfrm_policy_lookup时就找不到规则，从而增加了XfrmInNoPols的计数
​
​
nf_nat_decode_session的实现中去填充 flow 新的的地方是按照 conntrack 的 status 来填充的（nf_nat_ipv4_decode_session），状态位中有标记当前这个 conntrack 是否做了 SNAT 和 DNAT：
* iptables 模式中收到的包的 skb的 status 是 0x1ba， 是包含 snat(0x10) 和 dnat(0x20) 的
* ipvs模式中收到的包的 skb的 status 是 0x19a，只包含了 snat(0x10)，不包含 dnat(0x20)的
所以 decode_session 取到的 flow 的信息不对，从而导致了找不到对应的规则
​
ipvs 的 dnat 转换是在 ipvs 的 HOOK 中做的，所以不会在记录 conntrack 的时候打上 dnat 的status 的标记是预期的
​
解决办法有：
1. 尽量不使用 host 网络访问 ClusterIP，Pod 中收包的时候在 pod 的 namespace 中不存在 xfrm 的校验
2. 使用 kube-proxy 的iptables 模式
3. 修改 Raven，在每个 Gateway 节点上， 增加Service网段到本节点池的 Pod 网段的xfrm 规则以保证校验通过
​
第三种解决方案添加的规则：
```
ip xfrm policy add src <Service 网段>  dir in ptype main tmpl proto esp mode tunnel
```

**Comment by BSWANG** [comment]
ipvs 和 ipsec 一起使用的时候应该都有这种问题

**Comment by hackerain** [comment]
这里其实还有个解决办法，就是ipsec只打通主机网络，跨边pod->pod，以及service->pod的网络流量，仍然让它走flannel vxlan隧道，即走vxlan over ipsec的方式，进行跨边通信，我列举一些用这种方法的理由，看是否合理：

1. 首先云边主机网络打通是个刚需，即大多数人需要打开forwardNodeIP，尤其基于运维因素的考虑，kubectl exec, logs这些操作是常用操作；
2. 正常情况下，跨节点的流量就是flannel, calico这类网络插件负责的事情，raven如果直接通过vpn的方式把节点之间的pod网络打通的话，相当于是劫持了网络插件的流量，可能会遇到各种奇怪的问题，像本例的情况，还有可能也会跟calico的bgp路由产生冲突，如果我们想要取兼容更多的网络插件，就不应该去过多干涉容器网络；
3. 当规模大了，ipsec隧道和规则会非常复杂，首先把隧道打通可能就比较困难，我看到很多人都在挣扎这个问题，其次增大了出问题的风险以及出问题时排查的难度；

cni 网络插件 on ipsec的方式，结构简单，层次清晰，兼容性好，我想不出不用这种方式的理由，唯一的阻碍可能就是ipsec两端网段冲突的问题，这个其实也是开启forwardNodeIP之后会面临的问题，也是需要解决的，ipsec nat映射就是标准的解决办法，至于性能问题，本来跨边的网络质量就不高，多走了一层，损失也不大，得到的好处却是很大的。

所以，看是否有必要讨论下，还有其他因素我没考虑到，导致我们不能这么做的理由吗？

**Comment by BSWANG** [comment]
@hackerain 这样的话要求了上面的 CNI 网络必须是 overlay 的了，很多 flannel和 calico 的用户有的是 bgp 的方式就没办法支持了。raven 尽量做到对 CNI 的模式无要求。

**Comment by River-sh** [comment]
@hackerain  在raven组件设计和实现上我们提供了以下方法可以回答你的一些问题：
1. 云边运维以及promethues监控的请求，raven组件提供了proxy模式提供反向的七层代理隧道，可以通过一些配置完全兼容k8s生态。参考文档：https://openyurt.io/zh/docs/user-manuals/network/raven，轻量、简单。
2. raven组件的非跨域流量都是走CNI插件，跨域的流量通过raven的vxlan和vpn保证。我的理解是VPN打通主机网络只能提供三层网络联通性，Flannel host-gw或Calico BGP等常常要求二层联通性，是无法提供容器网络的联通的
3. 跨地域无法完全保证IP不冲突的，开启Raven Proxy模式以及Tunnel模式（不开启主机转发）可以覆盖绝大多数场景

**Comment by hackerain** [comment]
恩，确实，没有考虑到一些网络插件是需要二层通的，谢谢解答~
